What Color is Velvet?,"
<p>I’ve already mentioned that red is the traditional and most popular color for velvet, but blue was also used and other jewel-toned colors such as green. The reason that red and blue are popular for velvet is that they are associated with royalty.</p>

<p>Remember that velvet was originally made from silk, and even during the Middle Ages, silk was a rare and expensive fabric. Velvet fabric was also complex to make without the equipment that we have today.</p>

<p>Considering all of these factors, velvet fabric was expensive. Only the wealthy could afford it, which is why royalty and nobility were the primary wearers of velvet fabric. The fabric could also be woven into different patterns. The color or pattern on velvet fabric was sometimes used to symbolize a specific family. That’s why some noble families may have preferred to wear blue velvet over red.</p>

<p>Due to advancements in how we can make textiles and dyes in different colors, velvet is available in a lot more colors besides just red and blue. But even today, a lot of the colors used for velvet fabric are jewel tones.</p>

<p>Velvet fabric can come in different shades of red, blue, green, and even yellow and purple. And, due to the texture and sheen of velvet fabric, the color can look different at certain angles as a result of how light is reflected from that particular angle.</p>
"
Is Nylon Stretchy?,
What is Power Mesh Fabric?,
What Is Rayon Fabric?,"
<p>Rayon fabric is a semi-synthetic fabric usually made out of the chemically treated wood pulp. It’s synthetic because of the chemical processing even though the raw materials are plant matter, called cellulose.</p>

<p>Many manufacturers use rayon fabrics for inexpensive clothing because it is cheap to produce and shares many of the qualities that natural fibers have. The processing also lets manufacturers manipulate these qualities so that the finished fabric more closely resembles a specific fabric.</p>

<p>For example, the earliest rayon fabric was supposed to mimic silk to help save the floundering silk industry in 1860s France. Diseased silkworms created a shortage, so French scientist Hilaire de Chardonnet set out to find a way to make the fabric another way. His discovery is the first known rayon.</p>

<p>Since then, others have adjusted and improved on Chardonnet’s processes. Now, rayon can imitate the look and feel of cotton and linen, not just silk.</p>
"
Is Rayon Breathable Fabric?,"
<p>There are many factors that can contribute to making rayon breathable fabric. A few of them are as follows:</p>

<h3>The Chemical Composition of Rayon Fiber</h3>

<p>Manufacturers take natural raw materials such as bamboo, wood chips, or wood pulp and process them with various chemicals to derive rayon fiber. The resulting rayon fiber is naturally breathable.</p>

<h3>Intended Use of the Finished Fabric</h3>

<p>At every step in the manufacturing process, the manufacturer makes choices that can either enhance the fiber’s breathability or detract from it. These choices will depend on the intended end use of the finished fabric.</p>

<p>Rayon has many possible industrial applications. Besides apparel fabric, manufacturers use rayon to produce upholstery fabric, tire components, stuffing for furniture, and a broad variety of other products. Breathability isn’t an important consideration in finished rayon that’s destined for use in these other applications.</p>

<p>When you’re at a fabric store evaluating whether or not a particular rayon fabric is breathable enough to wear in the summertime, you’ll want to take that fabric’s original intended purpose into consideration. If a particular fabric you’re considering has a lightweight construction and is on a shelf with other apparel fabrics, it’s a safe assumption that the fabric will be breathable and wearable. If you found a rayon fabric shelved with upholstery fabrics, you’re better off assuming that the fabric might not be as breathable as you’re hoping.</p>
"
Is Rayon Stretchy?,"
<p>That said, rayon material can become stretchy when it contains spandex. Like most knits, knit rayon also has more flexibility and will more easily stretch to fit you.</p>

<p>You should also know that rayon has extreme sensitivity to heat and moisture. Unlike many synthetic fibers, rayon fibers can absorb moisture. This causes them to expand when wet.</p>

<p>This also means that you can easily stretch rayon while it is damp because its fibers will expand in this state.</p>

<p>Unfortunately, it also causes rayon to easily shrink when exposed to heat. For this reason, you should never put rayon clothing in the dryer!</p>
"
Does Rayon Shrink In the Dryer or When Washed?,
Does Acrylic Shrink In the Dryer?,
What Is Acrylic Fabric?,"
<p>Acrylic fabric is made out of acrylic yarns woven or knitted into thick, warm material. This material provides incredible warmth and insulation, making it a popular choice for sweaters, coat linings, and outdoor athletic apparel. This fabric often serves as a cheaper alternative to wool.</p>

<p>The same company that invented nylon designed acrylic during WWII. At the time, textile research had reached new heights, and people thought that synthetic fabrics might entirely replace natural cloth! Acrylic became quite popular in the 1950s, though its insulating abilities meant it mostly saw use for cold-weather clothing.</p>

<p>Then the increased environmental awareness of the 1970s introduced the public to the potential dangers of plastic-based synthetic fabrics. Polyester, nylon, and acrylic continued to see high use, but production dropped off in the United States.</p>

<p>Today, most acrylic manufacturing takes place in China and other Asian countries. Despite its sometimes contentious status in retail clothing, it remains a popular choice for cold-weather clothing today.</p>
"
What Is Tencel Fabric?,"
<p>Processed from the wood of the Eucalyptus trees, Tencel rivals cotton when it comes to appearance, durability, breathability, and softness. Unlike cotton, it uses wood pulp instead of plant fibers.</p>

<p>While it may sound like the fabric feels scratchy and stiff because it’s made of wood, the exact opposite is true. Thanks to its unique drying method called solvent spinning, this fabric has a smoother and more sophisticated feel compared to cotton right from the first use.</p>

<p>Classified under Rayon, Tencel is widely regarded for its uses in clothing, underwear, activewear, and beddings. Its breathability makes it a popular choice of fabric for summer attire.</p>
"
Does Modal Shrink In the Dryer or When Washed?,
What Is Nylon Fabric?,"
<p>Nylon is a manmade fiber first launched back in the 1930s by a company called DuPont. Described as a material stronger than steel, it created quite a buzz at the New York World Fair in 1939.</p>

<p>Touted as having phenomenal elasticity with superior strength, nylon was seen as the textile of the future. With a low production cost and the feel of silk, it’s easy to see why it took the world by storm.</p>

<p>Unfortunately, as stocking and tight wearers around the globe discovered, nylon is anything but run-resistant. You only have to snag it a little, and you have ladders in your pantyhose. After a re-think and a brainstorming session, the letters were changed and the company settled on nylon.</p>

<p>With the onset of World War 2, nylon textiles became synonymous with military use. Most famously, nylon was used for parachutes. After the war, the fabric used in the parachutes became a popular material for refashioning into dresses.</p>

<p>The fabric had its fair share of disadvantages. Early nylon material was uncomfortable to wear. Rather than replacing silk, it didn’t breathe, felt clammy, and was susceptible to damage from too much heat and everyday wear.</p>

<p>Not only that but, it suffered from static electricity and could spark without warning. As a textile, nylon was thought to be unstable. Its popularity waned.</p>

<p>Modern-day nylon textiles have come on a long way since those early days. One of the reasons for a revival in its popularity is down to blending. These days, nylon fibers are mixed with polyester, cotton, and spandex. Creating a fabric with all the benefits of nylon coupled with the stability and reliability of its less volatile cousins.</p>
"
Does Viscose Shrink In the Dryer or When Washed?,
What Is the Best Swimsuit Material?,
What Is Compression Fabric?,"
<p>Compression fabric is a tight-fitting but stretchy fabric that is made primarily from knitted nylon and spandex. Nylon improves the functionality of the fabric, while spandex gives it elasticity. Some compression fabrics can be made of up to 25% spandex. That means that they can potentially stretch up to 10% in length and 60% in width.</p>

<p>Together, nylon and spandex fibers help create a fabric that is extremely durable and lightweight while still being affordable. The overall design of clothing made from compression fabric helps to improve muscle function by increasing blood flow back to the heart.</p>

<p>Because of their function, compression fabrics are mainly worn by athletes, those with certain medical conditions where blood circulation is an issue or people who spend a lot of time working on their feet. Although some compression fabrics are designed purely for functional purposes, some are stylish as well.</p>
"
Does Lyocell Shrink When Washed?,"
<p></p>

<p>Even after you follow the proper steps and handle the product with care, lyocell will shrink up to approximately 5% after the first wash. However, the benefit of fabrics like lyocell is that it resists further shrinking if properly handled.</p>

<p>The caring procedure of Lyocell involves washing it at the right water temperature. Let’s see how cold and hot water affects the shrinking capacity of this eco-friendly material.</p>

<h3>In Hot Water</h3>

<p>Washing Lyocell under hot water will make it shrink more than usual. Unless you are intentionally trying to shrink the garment to make it sit nicely on your body, avoid continuously washing it under high-temperature water.</p>

<p>High temperature is not considered friendly for Lyocell products. Even if you hand wash the garments in hot water, their chances of shrinking will increase over time.</p>

<p>Lyocell garments are naturally soft and delicate on the skin. If you wash them excessively in hot water, they will lose these main characteristics that set them apart.</p>

<p>It is recommended that you always stick to the cleaning guidelines mentioned on the product’s label. While it is true that lyocell fabric will shrink from 3% to 5% only for the first few washes and will then become resistant to shrinkage, the fabric may have certain vulnerable areas. These sections of the fabric may shrink even further if exposed to high heat for too long.</p>

<h3>In Cold Water</h3>

<p>Regardless of the water’s temperature used for the first few washes, your lyocell garments will still shrink a minimum of 3%. However, apart from this initial shrinkage, cold water is considered appropriate for washing garments.</p>

<p>Whether you hand-wash your clothes or throw them in the machine at a gentle cycle, always use cold water. Your garments will be less likely to shrink, the colors will remain vibrant and intact, the chances of creasing and wrinkling will reduce, and your electricity cost will also be cut down.</p>

<p>If you tend to wash your lyocell garments regularly because of excessive use, you can safely place your bets on cold water.</p>

<p>However, if you are still unsure about the water temperature in which you should wash your lyocell fabrics, always stick to the instructions given on the garment label.</p>
"
What Is Tricot Fabric?,"
<p>Tricot is the name of a specific warp-based fabric. It comes from the French verb, ‘Tricoter’, which means knitting. Pronounced “tree-coat”, or “tree-co” to be closer to its French origins, this fabric is a unique knit material. The reason it stands out from other knits is that it isn’t knitted in the same way.</p>

<p>This is what gives the material its individual texture and durability. It’s also why a tricot fabric is easier to work with than any other knit. With the stability and firmness of woven fabric and the stretch of a knit, the textile has the best of both worlds.</p>

<p>Properties of a tricot textile are determined by the fiber content. Their characteristics can include heat-retention, water-absorption, quick-drying, antibacterial, and form-fitting. Whatever the fiber content, all tricot materials are run-resistant.</p>
"
What Is Muslin Fabric?,"
<p>Muslin is a plain-weave fabric. It has one warp thread woven through a single weft thread at a time. Traditionally, muslin is woven with very fine, thin, handspun yarn. The thinness of the fiber and the single layer of the weave makes it a delicate, lightweight fabric.</p>

<p>Muslin is also a very old style of fabric. It dates back to the 13th century when Marco Polo described it after visiting Mosul, Iraq. The city of Mosul also gives muslin fabric its name. However, most muslin historically came from Bangladesh and India.</p>

<p>For centuries, weavers made muslin by hand from beginning to end. They used cotton plants to make thin yarn, then wove that yarn into cloth. Muslin has a loose weave, so a single layer of muslin fabric is thin, flexible, and airy. The labor involved and the high quality of the resulting fabric made muslin incredibly valuable.</p>
"
Is Silk Breathable and Good for Hot Weather?,
Is Lyocell Stretchy Fabric?,
What Is Duck Cloth Fabric?,"
<p>Duck cloth fabric is a heavy woven fabric, usually made of cotton. It’s a plain woven cloth, meaning the warp and weft threads are at right angles to one another. For duck cloth, there are two threads in the warp and one in the weft.</p>

<p>Another term for duck cloth is canvas duck. Duck cloth is similar to canvas fabric, which is why it’s sometimes labeled canvas duck. Whether a retailer calls the fabric canvas duck or duck cloth, it is the same material.</p>
"
Does Benzoyl Peroxide Bleach Clothes?,"
<p>Benzoyl peroxide is a strong chemical compound that is frequently an ingredient in acne medication. It kills the bacteria that cause acne in your skin, but at the same time, it can bleach your hair, skin, or clothing.</p>

<p>The oils in your skin can transfer benzoyl peroxide from the surface of your skin onto your clothing easily. Even a small amount of benzoyl peroxide can have a mild bleaching effect on your clothes.</p>

<p>How much it bleaches your clothes depends on how strong the concentration of benzoyl peroxide is, how long it sits on the fabric, and how delicate the fabric is. The longer it sits, the more it will bleach. It will also have a harsher effect on more delicate fabrics.</p>

<p>Beyond acne medication, one of benzoyl peroxide’s primary uses is as a bleaching agent. If you get it on your clothing, it can and will bleach the fabric. The more contact it has, and the longer it sits on the fabric, the stronger the bleaching effect will be.</p>
"
What Are Pre-Shrunk T-Shirts?,
What Is Crepe Fabric?,
What Is the Softest Material For Blankets?,"
<p>There are many different kinds of soft fabric, each with its own pros and cons. Whether you’re making your own blanket or buying one, knowing about each fabric’s properties will help you pick the right blanket for your needs.</p>

<p>Some characteristics that make fabric soft are how dense it is, how long the fibers are, and what the fibers are made out of in the first place. Typically, the longer the fiber and denser the fabric, the softer the blanket will be. Add a soft fiber to the mix, and you have an excellent combination for a soft blanket.</p>

<p>You should also consider where you’ll use the blanket and how laundering the blanket will impact the softness. Items like baby blankets or camping blankets that need frequent washing should be a different material than a blanket that only gets a little use.</p>

<p>These six fabrics are all great choices for soft blankets, each with different strengths and weaknesses.</p>

<h3>Faux Fur</h3>

<p>The length of the fur in a faux fur fabric has an impact on the softness. There are low pile to high pile faux furs and some furs with a mix of lengths to look more realistic. The lower piles like faux chinchilla and faux rabbit tend to be softer than longer piles like a faux fox.</p>

<p>The density is also important. The closer the individual hairs are on the fabric base, the softer the overall fabric will feel. So the softest faux furs are the ones with a dense low pile.</p>

<p>The drawback to faux fur as a blanket fabric is that faux fur (like real fur) is only soft on one side. The faux hairs are acrylic or polyester fibers that the manufacturer attaches to a fabric base. The fabric base can be any fiber but is generally polyester. Unless the blanket is double-sided, the wrong side will not be as soft as the right side.</p>

<p>The quality of the synthetic fibers will also have an impact. Low-quality faux fur can have a plastic-y feel that a high-quality faux fur will not have. When you wash low-quality faux furs, the fibers can even melt or start to fray, decreasing the softness. If you’re going with faux fur for your blankets, make sure it is high quality and used in a place where it won’t be prone to spills or dirt that would require frequent washing.</p>

<h3>Fleece</h3>

<p>Polar fleece is a hard-wearing, easy-to-launder fabric. It’s usually made from polyester, though it can be made with recycled PET plastics or other fleece. It comes in various thicknesses; generally, the thicker the fleece, the softer it is.</p>

<p>One of the reasons it is easy to care for is because it doesn’t absorb water well, so it repels stains. This makes polar fleece a great choice for a blanket that will get a lot of use or is at risk for dirt and spills. Camping blankets made of polar fleece can be very soft.</p>

<p>The biggest drawback for polar fleece as a soft blanket fabric is that it can easily collect static electricity. If you’re wearing polyester clothes, wrapping up in a fleece blanket could generate unpleasant static electricity while you’re trying to relax.</p>

<h3>Cashmere</h3>

<p>There are two layers of hair on a cashmere goat, the guard hair and the undercoat. The guard hairs are coarse, but the undercoat is soft and fluffy. Both hairs have commercial uses, but the guard hairs are not soft enough for textiles. They’re used for brushes and tools, whereas the undercoat is used for garments and fabrics.</p>

<p>Cashmere goats naturally shed the undercoat, but farmers can also shear the goats to get it. Both processes are labor-intensive, which makes cashmere an expensive fabric. However, some manufacturers blend it with other fibers when they make the fabric to give it other qualities (like elasticity or durability) and lower the cost.</p>

<p>Like sheep’s wool, cashmere must be hand-washed, not machine washed, so it is not an ideal fabric for blankets that get messy easily, like baby blankets. However, it is incredibly lightweight, so you can get softness and warmth without bulkiness, making it a great choice for a throw blanket.</p>

<h3>Flannel</h3>

<p>The yarns that make up the weave are usually spun loosely so that the fibers are fluffier. This gives the fabric the raised nap texture that is so often associated with softness. Brushed flannels are even softer; they are brushed after weaving to raise the fibers and create a thicker nap.</p>

<p>Because it is woven, flannel is usually soft on both sides, especially if brushed on both sides. Cotton and synthetic flannels are great for people who are allergic to wool but still want the look and feel of wool fabric.</p>

<p>Depending on the fiber, flannel can also be easy to wash and dry. This makes it especially good for blankets that get a lot of use. There is even flannel made specifically for children and infants called baby flannel, which makes good baby blankets.</p>

<h3>Wool</h3>

<p>Wool fabric can be woven or knit, and the size of the yarn or thread used in the fabric can make a difference in how the fabric feels. Additionally, felted wool, which is agitated to make it denser, has a slightly different feel to unfelted wool.</p>

<p>The more a manufacturer processes the wool, and the longer the fibers are when they spin it, the softer the wool will be. Wool is also a fairly dense fabric with a natural fuzzy nap. These both contribute to softness.</p>

<p>Ultimately, the biggest factor determining how soft wool fabric will be is how thin the diameter of each fiber is. This is measured in microns, and the fewer microns per fiber, the softer the wool is. Wool with classifications like “ultra-fine” will be softer and smoother than other wools.</p>

<p>Wool is not machine washable, so it isn’t an easy-care material for blankets. It is naturally antimicrobial, so wool doesn’t need frequent washing as long as you don’t spill on it. It will repel dirt and bacteria that cause unpleasant odors.</p>

<h3>Chenille</h3>

<p>The weaving pattern, sometimes called leno, winds two warp threads around each weft. This makes it fluffy on both sides of the fabric. Throughout history, manufacturers have experimented with various techniques to add fluffiness to their chenille.</p>

<p>Manufacturers can make chenille fabric directly, or they can make chenille yarn and then use the yarn to make items like blankets. Regardless of the method, the resulting fabric is a tufted, fuzzy texture, with a pile similar to an extra-thick pipe cleaner.</p>

<p>Chenille comes in a variety of fibers ranging from synthetics to wool, cotton, or silk. Modern chenille fabric usually incorporates some low-melt nylon into the weave. Then, the manufacturer can steam the yarn or fabric, which melts the nylon enough to bind all the fibers together.</p>

<p>This technique means that while chenille fabrics can differ in their overall softness, all chenilles will be a long-lasting soft fabric. Chenille rose to popularity when it was primarily used for bedspreads and carpets, and it is still a very popular option for blankets and throws.</p>

<p>Most chenilles should not go in the dryer due to the low-melt nylon, but otherwise, chenille is an easy-care fabric.</p>
"
What Is Jersey Fabric?,
What Is Canvas Fabric?,"
<p>Canvas is a plain-woven fabric made of cotton, linen, or occasionally polyvinyl chloride (known as PVC) or hemp. There are multiple types of canvas and dozens of uses for it, including fashion, home decor, art, architecture, and more.</p>

<p>For centuries, people have used canvas because it is a hard-wearing fabric that’s relatively easy to make. The plain weave is strong and the use of natural fibers like cotton, linen, and hemp makes it durable in various conditions. While canvas isn’t a glamorous fabric, it is incredibly useful and versatile.</p>
"
Does Fleece Shrink In the Dryer or When Washed?,
Does Spandex Shrink In the Dryer or When Washed?,
What Is Taffeta Fabric?,"
<p>Taffeta fabric is a luxury fabric known for its stiffness, shininess, and rustling noise it makes. There are multiple types of taffeta, but they share these characteristics and a particular weaving technique.</p>

<p>It’s a plain-woven fabric made with twisted yarns to give it the stiff, crisp texture it’s known for. The fabric holds its shape well despite being lightweight. It’s also often shiny, which makes it a popular choice for formal wear, especially dresses.</p>

<p>The sound taffeta makes is one of its most noticeable characteristics. Because the fabric is so crisp and stiff, it rustles as you move when you wear it. Some fabric experts refer to the sound as “scroop”—a blend of two other sounds, “scrape” and “woop.”</p>

<p>The word taffeta comes from an old Persian word, “taftah.” Its meanings include “woven,” “crisp,” and “twisted.” The fabric originated in the Middle East around the 12th century, though it isn’t certain how similar that original fabric was to modern taffeta.</p>
"
What Is Suede Fabric?,"
<p>During the French Romantic period of the late 18th Century, Swedish gloves became popular due to the innovative methods used by the Swedish to process leather. Their gloves were the softest available and highly sort after by French noblewomen.</p>

<p>Thinner and not as strong as leather, suede fabric is a luxury material that oozes finery, status, and decadence. With the feel of cotton rather than animal skin, it can be easily mistaken for a plant-based natural fiber.</p>

<p>These days the term suede can refer to any leather with a napped surface. It’s also used for more than gloves. You’ll find suede in jackets, shoes, bags, and even skirts and dresses.</p>
"
What Is Mulberry Silk?,
What is Woven Fabric?,"
<p>With that being said, woven fabric refers more to the way fabric was created, not what the fabric is made of. You can have knit fabrics made from cotton, but you can also have woven fabrics made from cotton.</p>

<p>Woven fabrics are fabrics that were created on a loom. The fabric is made by weaving two or more threads together at right angles, either of the same or different fibers. This process creates a fabric with a specific texture and characteristics, but the exact appearance, as well as certain characteristics, just depend on what type of fiber the fabric was made from.</p>
"
How to Dye Satin Fabric at Home?,
