How Much Fabric Do I Need?,"
<p>It’s important to gauge how much fabric you’ll use in a project. There’s nothing worse than reaching the halfway point of a task to find you can’t finish it.</p>

<p>The return trip to the store to buy more supplies is distracting, inconvenient, and will have a befuddling effect on your brain. You’ll lose more than just time, you’ll lose track of where you are in the project. Having to rethink what you were doing when you get back will put a big dent in your incentive to complete your project.</p>

<p>To avoid the drain on your productivity, what do you need to focus on to make sure you get the right amount of fabric?</p>

<h3>Different Projects require Different Amounts</h3>

<p>The amount of fabric you need depends on the type of project you’re planning. From clothing to upholstery and home décor, each project is unique.</p>

<p>As well as requiring different amounts of fabric, you’ll find the type of fabric will be different too! Chairs need a heavier, durable material whereas blouses need lighter weight fabrics.</p>

<p>Each style or type of fabric comes on a particular sized roll or bolt. For curtains, you could be looking at a roll measuring over 100 inches in width. Fabric for clothing, on the other hand, comes on bolts or rolls from 36 – 60 inches wide.</p>

<p>The wider the fabric, the less you need. Your project and the style of fabric will have a huge effect on how much you need.</p>

<h3>How Big Is My Project?</h3>

<p>It sounds a little obvious but, have you sat down and thought about the project you are undertaking? How big is it?</p>

<p>Accurately assessing the amount of fabric you need relies on you knowing the true size of what you are trying to do. Let’s say you want to smarten up your living room by rejuvenating the tired old threadbare sofa with fresh, vibrantly colored fabric.</p>

<p>The first thing you need to measure is the sofa’s cushions. They are box-shaped so each one has a top, bottom, and sides. Then you need to consider the arms, the base, the back…</p>

<p>There is so much to measure in a sofa; it’s easy to forget something. Also, remember the rest of the room. How will the revived sofa fit in with your décor? Your armchair, for instance. Does it need new covers to match? What about your throw pillows?</p>

<p>Whenever you are working with fabric, you need to remember the hidden aspects of sewing. Things like seam allowance, pleats, gathers, and hems.</p>

<p>Most modern commercial patterns include an allowance for sewing the fabric pieces together and finishing edges. If you use your own self-drafted pattern though, remember to add extra space for seams, hems, and decorative finishes to ensure the item fits.</p>

<p>Also consider pattern matching. This is where you arrange the fabric at the seam line, so the pattern on the fabric is continuous. Making the seam almost invisible. Matching patterns or bold prints successfully requires more fabric than the sewing pattern recommends.</p>

<p>Before you think about fabric and the yardage needed, plan your intended project. What does it entail? Once you understand the size of your project, you’ll be able to gauge your fabric requirements.</p>

<h3>Why is it Better to Have Extra Fabric?</h3>

<p>One of the main reasons for making sure you have plenty of fabric is the color of the dye. Bolts or rolls of fabric are made in lots. Each lot will use the same dye.</p>

<p>The color of the dye can change from one batch of fabric to another. If you have to buy more fabric, you run the risk of an obvious color change. You might think it’s the same hue in the store, but when you get home, the difference could stand out like a sore thumb. Especially if you can’t hide the change in an inconspicuous area.</p>

<p>Another reason is making errors. Fabric cutting, in particular, is one of those areas that trips us all up. Having spare fabric to hand when you’ve been a bit liberal with the scissors is a great way to save your sanity.</p>

<p>While it’s true accurate calculations lead to a leaner, budget-friendly project, allowing wiggle room with extra fabric, could work out more economical in the long run.</p>

<p>It may seem a little extravagant at first but it saves you the horror of running out of fabric and not being able to find more. Besides, you can use the leftovers to make matching throw pillows, fashion accessories, or other small projects. Win win!</p>

<h3>How Big Is A Yard of Fabric?</h3>

<p></p>

<p>Fabric can come in a range of widths suitable for different projects. Material with a width of 110 inches, for instance, is ideal for larger tasks. Quilters’ cotton tends to be around 45 inches wide. Fabric for clothing can be a variety of widths from 36 inches to 58 inches. When it comes to fabric width you’re spoiled for choice.</p>

<p>A yard of the fabric refers to the length of the material. Whether you buy fabric for clothing, upholstery or bedding, the length will always be measured in yards, or if you use the metric system, meters.</p>

<p>How much fabric you get in that yard depends on how wide your chosen material is. For example, let’s use a width of 60 inches. If we use feet to make calculations a little easier, 60 inches is equal to 5 feet. A yard is the same as 3 feet. Multiplying the two together (5ft x 3ft), gives us 15 square feet of fabric. This is the surface area.</p>

<p>A shorter width of fabric will give you less surface area so your yard of fabric, although the same length, will be smaller overall. See our article How Big Is A Yard of Fabric for more information.</p>
"
Is Polyamide Fabric Stretchy?,
What Is Polyamide Fabric?,"
<p></p>

<p>When you hear the name polyamide, it’s easy to think it’s some form of polyester. Polyamide fabrics can be synthetic and are therefore presumed to be plastic. But, they aren’t members of the polyester family. Although the name would suggest it should be polyester, the artificial form is known as nylon.</p>

<p>Polyamide fabrics aren’t always made from synthetic materials. Polyamide is a term used to describe the molecular structure of the fiber, regardless of whether it’s artificial or organic. Natural fibers like silk and wool are classed as polyamides. To understand why the polyamide genome can be used to cover both types of fiber, we need to look at the chemistry behind the terminology.</p>

<p>As the most popular plastic-based fabric is called polyester, it can be tempting to think the prefix “poly” stands for plastic. It doesn’t. Poly comes from the word polymer, which means a substance made from long chains of similar blocks all joined together. They are joined, or linked, by amides. Hence the name poly-amide.</p>

<p>Although polyamide technically covers both natural and synthetic fibers, we don’t refer to the organic versions by their molecular term. We call the natural products by their fiber name of wool or silk. We only describe synthetic materials by their chemical term. This is why we think of synthetic materials when we see the word polyamide. With that in mind, it’s the synthetic version we’ll be concentrating on in this article.</p>

<p>Synthetic polyamide fabrics are petroleum-based and have many characteristics of artificial fibers, both good and bad. They are not breathable fabrics and can feel like plastic against the skin. Their incredible strength and durability feature highly in the popularity of these fabrics for both fashion and industrial uses.</p>

<p>Nylon, Kevlar, and Nomex are all examples of synthetic polyamide fabric. Kevlar is used in the construction of bullet-proof vests. Nomex is a brand name for DuPont’s heat and flame-resistant textiles. Nylon was famously used for parachutes in World War 2 and is still a popular choice for a range of products from tights to umbrellas.</p>

<p>Polyamide fabrics have differences that set them apart from their closest synthetic rival, polyester. While polyester is quick-drying and water-resistant, polyamides like nylon are absorbent and slow to dry. This unique difference can make polyamides more comfortable to wear.</p>
"
How Much Fabric Do I Need for Curtains?,
What Is a Sherpa Blanket?,"
<p>Made from synthetic fibers, a Sherpa blanket will have a textured side and a smooth, soft leather effect on the other. It’s a lot like a wooly top with a suede bottom. So much so that its appearance mimics the look of sheepskin.</p>

<p>Blankets made from Sherpa fleece are cozy and warm, with one added benefit not found in many other blankets. They are incredibly lightweight.</p>

<p>A Sherpa blanket lacks the heaviness of wool and yet is thicker than other fleece blankets. Having both these amazing qualities make Sherpa blankets hard to beat for warmth, comfort, and practicality.</p>
"
What Is Brocade Fabric?,
What Is Upholstery Fabric?,
Does Linen Shrink Or Stretch?,
Does Hand Sanitizer Stain Clothes?,"
<p>Although hand sanitizers don’t ‘stain’ clothes, some fabrics can be damaged by the ingredients found in many brands. As we apply the sanitizer, it can spill or splatter onto clothing and other surfaces. When the liquid lands on fabric, it forms little discolored spots that can look like stains. The marks are in fact where the fabric has been bleached.</p>

<p>Alcohol is one of the main ingredients in sanitizers due to its antibacterial qualities. It’s also a known stain remover. This can be a bit of a problem when it comes to our clothing. As far as alcohol is concerned, there is no difference between stains and colors.</p>

<p>The stain removing properties of alcohol relies on its ability to act as a bleaching agent. In other words, it alters the look of an item by removing its color. Unfortunately, because the alcohol is dropped in random places and tiny amounts, the bleaching process only works in affected areas. Leaving a spotted effect on the fabrics.</p>
"
What Is the Best Fabric for Canopy Beds?,"
<p>The best fabric for a canopy bed is the one that gives you a look you were hoping to achieve. Modern canopies can be made from any type of material. Your choice ultimately depends on your room décor, personal preference, and the style of your chosen canopy.</p>

<p>With so many fabrics available and a project that can use any of them, picking one can seem like a daunting task. Let’s take a look at some fabrics more commonly used for canopies. By checking them out side-by-side, you should be able to tell which one will be best for your canopy bed.</p>

<h3>1. Lace</h3>

<p>Better suited to canopies that need smaller amounts of fabric, lace in large quantities can be a bit overwhelming.</p>

<p>Crown and half-tester style canopies are a good choice for this type of fabric.</p>

<h3>2. Silk</h3>

<p>You may find a full-size canopy with floating drapes a bit pricey if you make it out of pure silk.</p>

<p>A silk alternative like rayon can give the same effect with a cheaper price tag.</p>

<h3>3. Velvet</h3>

<p>Suitable for any style of the canopy, watch the overall weight with this fabric. Some velvets can be incredibly heavyweight.</p>

<p>This could be a problem if your canopy type relies on being suspended from the ceiling rather than on posts.</p>

<h3>4. Chintz</h3>

<p>It’s another traditional fabric used for canopy beds that has a modern aesthetic and appeal.</p>

<p>As cotton is available in lightweight and heavier weight weaves, this choice is ideal for any style of canopy. If cottagecore is your thing, this one is right up your street.</p>

<h3>5. Tapestry</h3>

<p>Because of the nature of the fabric, this one is a heavyweight.</p>

<p>Perfect for full-size canopy beds with the traditional four-poster style, you might find a tapestry design a little heavy for the softer crown or half tester style beds.</p>

<h3>6. Muslin</h3>

<p>Slightly translucent and having a nice drape, it’s an ideal material for creating romantic canopy beds.</p>

<p>Muslin can be used for any style of the canopy and can be used as a full covering or gentle, strips of delicate swags. Either way, muslin will give your bedroom a hint of romance.</p>

<h3>7. Gingham</h3>

<p>A gingham weave in any color will give your room a sense of rural chic. This one is a popular choice for any canopy but looks particularly impressive when used in the crown style. Embrace your inner cottagecore with the pastel simplicity of gingham.</p>
"
What Are Different Types of Fleece?,
How to Trace a Sewing Pattern Onto Fabric?,
What Is Yarn Dyed Fabric?,
Does Polyester Fabric Fade in Sunlight or When Washed?,
Does Hydrogen Peroxide Bleach Fabric?,
Does Polyester Bleed?,
How To Tell If Fabric Is 100 Cotton?,
What Is the Best Fabric for Yoga Pants?,
How Big is a Fat Quarter of Fabric?,
Is Viscose Breathable Fabric?,"
<p>While viscose will absorb moisture from your skin, it takes the fabric a lot longer to dry than most other fabrics. It will cool you down, but it may begin to feel clammy if it gets too wet while you’re wearing it.</p>

<p>Due to these two properties, manufacturers often mix it with other fibers to make fabric blends. The blend helps lower the cost of a garment or fabric without sacrificing the look, feel, or properties of the second fiber.</p>
"
Is Viscose Stretchy Material?,
What Is the Most Breathable Fabric?,
What Is the Standard Width of Fabric Bolt?,"
<p></p>

<p>Fabric width varies by manufacturer and fabric type. While there isn’t a standard width for all fabric bolts, there are ways to estimate how wide fabric is before you measure it. Similar fabrics tend to have similar widths; for example, most cotton fabrics have the same width whereas most wools have the same width, but wool and cotton won’t necessarily have the same width as each other.</p>

<p>The average width for fabric you’d find in a local craft store or fabric store is between 40 and 60 inches. When you see fabric rolled up on rectangular cardboard bolts, it’s safe to assume that the width is going to fall somewhere between 35 inches and 108 inches. Knowing the kind of fabric will help you make a closer guess.</p>

<h3>What Is Single Width Fabric?</h3>

<p>Single-width fabric refers to any fabric that’s wrapped around the bolt unfolded. When you unroll a single-width fabric, you’ll only have one layer on your cutting table. The selvage edges will be on opposite sides of the fabric, and you’ll be able to clearly see the right and wrong sides of the fabric. Single-width fabric is usually wrapped around the bolt with the right side facing outwards, so you can see it.</p>

<h3>What Is Double Width Fabric?</h3>

<p>Double width fabric is a fabric that is folded in half widthwise before the manufacturer wraps it around the bolt. When you unwrap this fabric, the selvage edges will be on the same side, and the opposite side will have a fold.</p>

<p>This is how extremely wide fabrics like upholstery or drapery fabrics are packaged. Typically, the right side of the fabric will face outwards, and the wrong sides will be facing each other inside the fold. When you cut this fabric off the bolt, you’ll have a double layer.</p>

<h3>Fabrics with Narrow Widths</h3>

<p>Narrow fabrics tend to be materials that you use for smaller pieces, like interfacing. You don’t need as much width, so bolts of interfacing tend to be closer to 30 inches than 40. Vintage fabrics, especially cottons and muslins, also tend to be narrower than 40 inches.</p>

<p>Smaller looms lead to narrower fabrics, so fabric manufactured outside of a commercial setting is more likely to be narrow. These fabrics are generally older, or more specialty. It is rare to find these fabrics in your average fabric store.</p>

<h3>Fabrics with Average Widths</h3>

<p>The vast majority of fabrics that you’ll find today will fall within the 40 to 60-inch range. Quilting cotton and most apparel fabric fit these parameters. Within this range, quilting fabrics tend to be larger than others.</p>

<p>Cotton is typically a few inches wider than flannel, and wool is usually a few inches wider than cotton. All of these, however, will be single-width fabrics. If you find an apparel fabric that’s folded double on the bolt, it’s going to be an extra wide fabric.</p>

<h3>Wider than Average Fabrics (Extra Wide Fabric)</h3>

<p>The most common extra wide fabrics are for upholstery and home decor. These fabrics tend to be packaged as double width because they’re so wide. They are typically between 54 inches and 108 inches wide. Home decor fabrics with intricate patterns like brocades are usually extra wide to reduce the need for pattern matching and seaming on large items, like couches or drapes.</p>

<p>Some less common apparel fabrics also show up in extra wide widths. Knit jersey, corduroy, and twill skew wider, because of the way they’re made. Knit jersey is more likely to be sold double width than corduroy, however, because it is easier to fold.</p>

<p>Quilt backing is also commonly sold in extra wide widths. Backing an entire quilt in one seamless piece of fabric usually requires more than 60 inches in width. A standard queen-size bed is 60 inches across, so making quilts to fit anything larger than a queen requires wider quilt backing.</p>
"
Is Polyester Stretchy?,
Does Flannel Shrink?,"
<p>Flannels shrink when you wash them in hot water. By hot water, it means 120 degrees Fahrenheit or higher. This popular fall fabric needs your loving, tender care, so when washing your favorite flannel pajamas, boyfriend’s shirt, or blanket, set your washer to cool water. A low-heat setting, or warm water, is also okay.</p>

<p>Most flannels are made up of wool. Wool is a type of textile fiber that comes from animal hair— such as sheep and goats. The surface of these animal hairs is comprised of microscopic scales. When these scales are exposed to heat, they mesh and shrink, causing the wool to stiffen and get shorter.</p>

<p>Apart from heat exposure, there are other reasons why flannel can shrink. Yes, this fabric is notorious for shrinking when tumbling. Let us count the ways!</p>

<h3>Tumbling Action</h3>

<p>Some modern-day flannels are made up of 100% cotton. Some say cotton does not shrink when exposed to heat. That’s a complete myth. Cotton shrinks when it tumbles inside your washing machine or dryer.</p>

<p>When washing your flannel in cold water (whether it’s made up of wool, cotton, or synthetics), it is important that you set your washer to a “gentle cycle”. When violently churned, flannel can either shrink, fray, and pill.</p>

<p>Yes, flannel can get stressed and shrink in size when you beat it up with rigorous washing. Be kind to your flannel. If you don’t trust your washing machine, then hand-wash your ultimate cozy fabric.</p>

<h3>Low-quality Flannel</h3>

<p>If there are good quality flannels, then there are also low-quality ones. Your cheap flannel can shrink over time. It is important to know what to check when you are shopping for one of the coziest and most breathable fabrics on Earth.</p>

<p>First, check the weave. One way to check is by tugging it a little, and if it gets warped a little, then you know you have the poor quality kind. High-quality flannel is a little heavy, full and thick, and has a natural fluff to it. Brush it up against your cheek for its fuzziness. Authentic flannel does not lay flat.</p>

<h3>Bad Chemicals</h3>

<p>The wrong choice of detergent can kill your flannel and cause it to downgrade in size. Washing with detergents that you merely picked by random is a no-no. Chemicals in your laundry soap, like chlorine, enzymes, and phosphates are dangerous to your winter flannels.</p>

<p>Using a fabric softener is also bad for your flannels. Your fragrant fabric softener contains chemicals that create an invisible coat over the fabric that chokes the fibers. Unable to breathe because of the softener’s barrier-causing chemicals, the fibers can no longer hold the fabric’s shape.</p>

<h3>Drying Them Hot</h3>

<p>You would not want to remove your flannel shirt from the dryer and be surprised that it has shrunk to the size that would fit someone half your size. Drying this fabric hot will automatically cause your flannel to magically become 2 to 3 sizes smaller. So, it’s not just washing them in hot water, but also drying them in heat, that will damage your flannel.</p>
"
What Is the Best Fabric for Pants?,
Is Silk Fabric Stretchy?,"
<p>This natural fiber is very elastic, but one single cocoon is not enough to create the textile. When these single strings are put together to form textiles, some of the elasticity decreases. In order to make silk, someone has to unwind the string of the cocoon and then connect it to another string. It takes about five cocoons to create a whole thread of this material. Over 2,000 cocoons are needed to produce a pound of silk.</p>

<p>The elasticity of this material depends on how it was knit or woven together. Most of the material is a lightweight, smooth weave that usually allows for some stretch. However, heavy-weight silk weave fabrics do exist and while they would not typically be stretchy, they could be with water or some steaming. Sometimes the textiles are mixed with stretchier fabrics such as spandex and nylon to provide more elasticity.</p>

<p>These textiles are used in many ways for different reasons. The material is great for summer blouses and dresses because of how breathable it is. It can also be insulating which makes it great for bedsheets and scarves. The textiles’ natural drape and notable shine make for great bridal wear too.</p>

<p>These four types of textiles are very stretchy and often used in silk products today.</p>

<p>Some silks are mixed fabrics and have more stretch to them. Some of the weaves are tight, and that type of silk can still be stretchy. Another type of textile with a different tight weave can be too stiff to stretch. These textiles are made in a large variety of weaves and knits which is why the fabrics vary in elasticity and weight.</p>
"
Does Nylon Shrink In the Dryer or When Washed?,
What Is Technical Fabric?,
What Is The Strongest and Durable Fabric Material?,
Is Polyester Flammable?,
Does Polyester Shrink in the Washer or Dryer?,
Does Cutting Paper Dull Fabric Scissors?,"
<p>Yes, cutting paper will dull your fabric scissors. So, if you have high-quality sewing scissors you should avoid cutting paper or anything else with them.</p>

<p>While you can cut some paper just fine with your fabric scissors, it will eventually dull them. This is due to the harsh minerals and materials that go into the paper. The stiffening agents in most papers are the worst offenders.</p>

<p>In particular, abrasive materials like talc and kaolin clay damage and dull fabric scissors. The sharp edge of sewing scissors is simply not made to take damage like that.</p>

<p>Cardboard and similar materials should also be avoided. In short, do not cut anything other than fabric with fabric scissors.</p>

<p>If you end up accidentally cutting paper or anything other than fabric, not all is lost. While it will dull the scissors, it is fairly easy to sharpen them.</p>
"
What Color Is Linen?,
What is a Pressing Cloth?,
Is Wool Flammable?,"
<p>Wool is made by shearing the coat off of animals. Many think only sheep produce this material but some of the finest of these fabrics come from camels or llamas. After the material is sheared, it’s cleaned to remove excess oils. Sometimes it’s dyed right after the cleaning process and then it’s referred to as stock-dyed wool.</p>

<p>After cleaning the product, it gets sorted into different grades of fleece. The fleece is then flattened with a big metal machine and threaded into yarn. The material can also be dyed after being spun into yarn.</p>

<p>Wool can catch fire, but because of its cell structure, it will likely extinguish any flame that ignites. The reason this material is easy to dye is that it is naturally hydrophilic. This means it likes water. Its natural water contents make it difficult to catch fire. The fact that it has such a high water content as well as a high nitrogen content makes it difficult to ignite and keep the flame burning.</p>

<p>The material has a high LOI which means limiting oxygen index. In other words, if set aflame, this textile needs mass amounts of oxygen to sustain the flame, otherwise, it will snuff the flame out naturally. So while the textile is flammable, it is one of the safest natural fabrics regarding fire safety practices. If you go camping, a wool sweater is a great choice of apparel around the campfire.</p>
"
What Is Quilting Fabric?,
What Is Pima Cotton Fabric?,
What Is Scuba Fabric?,
What Is Minky Fabric?,
What Is Piqué Knit Fabric?,
Does Wool Shrink In the Dryer or When Washed?,
What Is Slub Knit Fabric?,"
<p>Natural fibers, like cotton or wool, tend to spin unevenly. When spinners got lumps of thicker fiber along the thread they were spinning; the lumps were called slub. The slubs aren’t as tightly twisted as the rest of the thread, making them thicker and softer than the surrounding thread.</p>

<p>Making fabric with slubs in it leads to an uneven texture, with ripples and bumps on the surface. This was a defect, so most spinners picked out the slubs or threw the yarn out.</p>

<p>Machine-spinning helped reduce slub, even in natural fibers. This created the more consistent, uniform fabrics we’re familiar with today. However, this technology also made it possible for manufacturers to create more evenly spaced, intentional slubs.</p>

<p>These intentional slubs create a beautiful visual effect in the final fabric. Slub often takes color differently than the rest of the yarn. Knitting slub into fabric makes a heathered look and texture. You can also use slub for woven fabrics with similar results.</p>
"
