What Is the Standard Throw Blanket Size?,"
<p>The standard size for most throw blankets is 50 inches in width by 60 inches in length. However, different makers of throw blankets may have what they consider to be the standard size. This is why many throw blankets can vary from these dimensions, including differences in both the length and width measurements.</p>

<p>But, another reason for differences in the size of throw blankets is to accommodate different sizes of people. For example, taller people may need a longer throw blanket, while shorter people prefer a smaller throw blanket.</p>

<p>There are throw blankets that are smaller in length and width that can accommodate smaller people or accent small chairs or beds. A small throw blanket would have dimensions at or around 36 inches by 50 inches. Just for reference, a blanket this size could easily cover a small child’s entire body.</p>

<p>Medium-sized throw blankets typically have the standard dimensions of 50 inches by 60 inches but can be anywhere from 45 inches by 55 inches to 60 inches by 60 inches. These blankets are usually large enough to cover most people comfortably without being overwhelming. They’re also large enough to drape over the back of a chair or couch.</p>

<p>A large throw blanket is considered to be bigger than the standard size. At a minimum, a large throw blanket would likely have dimensions of 50 inches by 70 inches, but some can be even larger. Large throw blankets are the ideal size for people with long legs and may want a little extra coverage.</p>
"
How A Shirt Should Fit?,
What Is Dri FIT Material?,
What Is Best Fabric for Sewing Tablecloths?,
What Is Mesh Fabric?,"
<p>Mesh fabric is a generic term for any material with a grid-like structure made up of rows of evenly-spaced holes. The size of the holes can vary from small to large, depending on the purpose of the mesh. You can also find mesh fabric made from a variety of materials, from metal to polyester.</p>

<p>Founded by a British Mill owner called Lewis Haslam, mesh fabric has been used in apparel since the late 19th century. Originally known as Aertex, mesh didn’t become part of popular mainstream fashion until the 1980s. Its eventual rise to fame has been attributed to the stars of MTV and pop videos.</p>

<p>As a ubiquitous material, the mesh can be found in products ranging from tea strainers to string vests. You can also find mesh in screen doors and the flyscreens on your windows. Not only is it versatile and practical, but it can also be used as a fashion statement. Creating structure and interest in any garment from fishnet stockings to mesh pullovers.</p>
"
What Is Twill Fabric?,
What Is a Ribbed T Shirt?,
What Is Ponte Fabric?,"
<p>Ponte fabric is a stable knit made from a blend of polyester, rayon, and spandex. It originated in Italy back in the late 1960s/early 1970s as a fabric for designer clothing.</p>

<p>The full name of the fabric is Ponte De Roma which is Italian for “Bridge of Rome” or “Roman Bridge”. It’s thought the name refers to the pattern of the fabric’s interlocked yarns. They look like little arches. This is reminiscent of the arches found in two famous styles of Roman bridges, the aqueduct and the viaduct.</p>

<p>These days you’ll find the fabric has a few different terms. From Ponte Roma, Ponte di Roma, Ponteroma or the more common, Ponte. In all cases, it is pronounced as Pontee.</p>

<p>Unlike some knit fabrics, Ponte doesn’t unravel or run. It’s a thick fabric compared to other knits because it is a double-layered material. Otherwise known as a stable knit, Ponte has structure, excellent drape, and a comfortable stretch.</p>

<p>The fabric is available in lightweight, mediumweight, and heavyweight options, making it an ideal textile for various projects. You can make form-fitted dresses, comfy pants, and structured pencil skirts from this versatile material.</p>
"
What Is the Best Fabric for Tie Dye?,
How Much Does A Hoodie Weigh?,
How to Get Permanent Marker Out of Clothes?,
Does Hot Glue Work on Fabric?,"
<p>Applying hot glue on fabric seems to be a quick solution for art, craft, and household needs. The good news is, hot glue works on fabric, but you need to be careful about applying it.</p>

<p>It is best to use low-temperature hot glue guns on fabric because they melt and apply the hot glue at a lower and more fabric-friendly temperature.</p>
"
What Are Chino Pants?,"
<p></p>

<p>Chino pants are a lightweight and comfortable alternative to jeans and formal suit trousers. Made from a cotton twill fabric, they are semi-fitted, making them ideal for casual and formal occasions. Hugging the hips and thighs, they have a gentle taper through the leg, which ends in a close-fitting ankle.</p>

<p>Incredibly flattering for any body shape, chino pants have been part of men’s fashion since the end of the 19th Century. Over time they have become a popular wardrobe stable affectionately known as chinos.</p>

<p>Originally, they were introduced as military apparel worn by Americans fighting in the Spanish-American war of the late 1800s. The war took place in the hot climatic conditions of the South Pacific. Because of this, military uniforms needed to adapt to the warmer temperatures experienced in the region.</p>

<p>The army needed to re-think their uniform strategy. They were looking for a long-lasting, durable fabric that wouldn’t be too hot to wear in the tropics. The answer was a cotton twill weave.</p>

<p>It’s no secret that cotton is one of the best materials you can wear in warm weather. This is because of its breathability and cooling properties. Another advantage is It’s an incredibly durable fabric.</p>

<p>When woven into a twill weave, cotton is one of the strongest fabrics you can get. So much so, people have been working in cotton twill fabrics for generations. When you think of manual labor, what’s the first fabric that springs to mind? Chances are you thought denim, the most famous twill weave fabric on the planet.</p>

<p>Denim is a bit too heavy for the tropics, so a lightweight twill weave fabric was imported from China and turned into a lighter, slimline version of denim pants. These days we would probably have called it denim-lite, but back then, soldiers came up with something a little closer to the situation they found themselves in.</p>

<p>They were fighting the Spanish, wearing pants made from Chinese fabric. What better name could they come up with, other than chinos? In Spanish, Chinos translates as Chinese men. Now, it isn’t known for certain that is the reason behind the name, but it sounds plausible and makes sense.</p>

<p>Modern-day chinos can be worn anywhere. Team them with a baggy t-shirt, and you have a casual look for a walk in the park. Wear them with a dress shirt and smart pair of shoes, and you’re all set for the office. This versatility makes chinos ideal for any eventuality and makes them a perfect fit for a capsule wardrobe.</p>
"
Does Silk Shrink In the Dryer?,
What Is the Rise on Jeans?,
Does Cashmere Shrink In the Dryer or When Washed?,
What Is Chenille Fabric?,"
<p>Chenille is a soft fuzzy fabric with a tufted pile. The surface of the material has both thick and thin sections that create a ridged effect. It can be made from silk, wool, rayon, cotton, and synthetic blends. Considered an elegant fabric, chenille is popular for blankets and upholstery, but it can also be made into clothing.</p>

<p>As far as textiles are concerned, chenille is relatively new in the world of fabric. Although the yarns used to make the fabric can be traced back to 18th Century France, they didn’t appear in garments until the 1830s.</p>

<p>A Scotsman and mill owner called Andrew Buchanan is credited with being the first person to use chenille fabric for clothing. He used chenille yarns to create a textile suitable for use in shawls. These became a popular garment to protect against the variable weather conditions found in Scotland.</p>

<p>Originally, yarns used for the material were created by encasing one weft thread inside two warp threads. The warp threads were twisted together and the weft thread would have been threaded through them. This was known as the leno method. It was labor-intensive and slow-going to make the yarns in that way.</p>

<p>Some enterprising individuals decided to speed things up a bit. There are three names synonymous with furthering the popularity of chenille. First to upgrade the production process was a duo called James Templeton and his partner William Quiglay. They used their patented technique to make rugs.</p>

<p>The most famous name of all came later in the 1890s. A lady called Catherine Evans further enhanced the process of making chenille fabric. She had fallen in love with a super soft quilt she had seen when she was 12. By the age of 15, she’d done it! She’d not only recreated the quilting technique, but she’d also managed to revolutionize the way chenille was created.</p>

<p>Her efforts led to chenille becoming a popular choice for quilts and bedspreads. Although her original intention was to revive a quilting technique known as candle wicking, she helped put Georgia USA on the map for chenille mats, bathrobes, and carpets.</p>

<p>The textile’s name is a nod to its appearance and French origins. The fabric has a fuzzy surface reminiscent of the furry little caterpillars, it became known as chenille. Chenille is the French word for caterpillar.</p>
"
How Much Do Jeans Weigh?,"
<p>The weight of any piece of clothing, including jeans, depends on several things. Fabric choice is one of the main contributing factors. Authentic denim made from 100% cotton will weigh more than a synthetic alternative.</p>

<p>Next, the style of the jeans will make a difference. Due to the fiber content, baggy or regular fit jeans will weigh heavier than skinny jeans. Tight-fitting jeans use stretch denim which contains elastane. The ability to stretch allows the jeans to be cut smaller and use less denim.</p>

<p>Another factor is the size of the item. Adult clothing, especially if it’s made from a heavy fabric like denim, will weigh more than a pair of jeans for a toddler. Simply because adult garments are bigger and contain more material.</p>

<p>Thread count or the thickness of the material used to make the jeans will alter the weight of the denim. A heavier weave will result in heavier jeans.</p>

<p>You’ll also find the number of pockets will make a difference as the more you have, the more material will be in the jeans. Rivets, zippers, and even the number of seams will also affect the overall weight.</p>

<p>Having said all that, jeans are a bit of an anomaly. The weight of 12.5 ounces listed on the price tag of those new Wranglers you bought isn’t referring to the weight of the jeans. Manufacturers don’t tend to weigh the finished garment. They weigh the denim. Or rather the amount of denim per square yard of fabric used to make the jeans.</p>
"
Is Wool Waterproof?,
What Is the Standard Table Runner Size?,
What Is Batting Fabric?,"
<p>Batting fabric is the fluffy filling layer that forms the inner part of a quilt sandwich. It can be made from many fibers, including cotton, wool, and polyester. Whatever it’s made from, it performs the same role. Adding warmth and comfort to quilts and insulation properties to things like potholders and placemats.</p>

<p>These days you can buy batting in pre-cut sizes wrapped neatly in cellophane bags. There’s a size available to suit most quilts. You can even buy batting off the bolt or roll. In this case, it would be sold by the yard and ideal for custom-sized quilts. But it hasn’t always been that way. You see, ready-made batting is a relatively new invention.</p>

<p>Quilts, on the other hand, have been around since at least the 12th Century, maybe even earlier. Originally, they would have been stuffed with whatever the maker had to hand, from animal hair, human hair, feathers, clothing scraps, old blankets, and even straw.</p>

<p>All of these items had one thing in common. Because they were all individual pieces rather than one large flat piece of fabric, they tended to move. Bits would clump together to create little heaps of stuffing known as wads.</p>

<p>This irritating drawback to the quilts of yesteryear gave quilt stuffing its original name. Traditionally it was called “wadding”. Some parts of the world, such as the UK and Australia, still use the term wadding when referring to quilt stuffing.</p>

<p>If we jump forward to the United States in the 1800s, there’s a change to the fiber content of quilts. You start to see wool and cotton becoming the go-to choice for stuffing. These fibers would be carded into small lumps called batts.</p>

<p>In a similar way to wadding, the process of making the little batts became known as batting. This probably explains why wadding is called batting in the USA.</p>

<p>Regardless of the terminology, both wadding and batting needed to be kept stationary inside the quilt. No one likes a lumpy bedspread, not even back in the 1800s!</p>

<p>The quilt would have been heavily stitched by hand to stop the filling from bunching up. As time went on, this stitching became more and more decorative. Not only did it keep the wadding or batting in check, but it was also a showcase for fine needlework.</p>

<p>These days, modern batting is a single sheet of fibers woven into a fabric. This means there is less need for as much stitching to keep the fabric in check. Quilters still take the time to stitch decorative designs either by hand or machine.</p>

<p>Not only does it allow for two sheets of batting to be stitched together to use up scraps, but it also adds a personal touch to the quilt. In so doing, it keeps old quilting traditions alive.</p>
"
What To Do With Old Sewing Machine?,
What Size Sewing Machine Needle Should I Use?,"
<p></p>

<p>Once you select the right style of needle for your project, you will need to choose a needle size based on the weight of your fabric. Most of the time lighter material works best with a thinner needle, and heavier material does best with a thicker needler.</p>

<p>But how do you pick a thick or thin sewing machine needle? You can easily learn the numbering systems used to explain needle thickness.</p>

<h3>Sewing Machine Needle Sizes</h3>

<p>Sewing machine needle sizes are usually represented as two numbers representing the thickness of the needle’s shaft. How do you know what this measurement means? Let’s get down to the numbers!</p>

<p>Why do needle sizes use two numbers? Well, one number indicates the European method of sizing. The other number uses the American sizing system.</p>

<p>You will see measurements listed both with the European number first and the American second and with the American first and the European second! Yes, this is a bit confusing, but don’t panic! Both measurement systems follow the simple rule that bigger numbers mean a thicker needle.</p>

<p>The European numbers use the metric system, based on hundredths of a millimeter. For example, a needle measurement of 100 means that the diameter of the needle’s shaft is 100 mm thick. This numbering system ranges from 60 to 120, and smaller measurements indicate a thinner needler.</p>

<p>The American system exists because Singer made it popular long ago. It ranges from 8 to 19. Smaller numbers mean a thinner needle in this system as well.</p>

<p>So, if you see a measurement of 12/80, the 12 indicates the American measurement and the 80 indicates the European measurement. A 12/80 ballpoint needle works great with knit materials!</p>

<p>Remember, though, that you might also see this needle size expressed as 80/12.</p>

<p>A thin needle with a measurement like 10/70 (or 70/10) works with fine materials such as silk and organza. You will also need to find a lightweight thread to fit through the small eye.</p>

<p>Thicker needles with high measurements work best with heavyweight fabrics.</p>

<h3>Cotton</h3>

<p>Universal needles in an average size of 12/80 or 14/90 work well with cotton. The eye in this size of the needle will easily allow an everyday polyester thread to fit through.</p>

<p>If you’re topstitching or quilting with cotton material, you may want to use a sharp needle in a 12/80 or 14/90 size instead. You see experts recommend using a sharp with cotton all the time because their tapered points slide through lightweight wovens so easily.</p>

<h3>Knits</h3>

<p>As you already know, ballpoints are the way to go with knit fabrics! Ballpoint needles come in a wide range of sizes, so you should select the size based on the weight of your material.</p>

<p>If you’re working with a heavy knit, you might want a 16/100 ballpoint. If you’re working with a knit so thin and light you can almost see through it, you might want a 10/70 ballpoint.</p>

<p>Of course, if you plan to use a stretchy knit, you may want to consider using a stretch needle instead. This will help you avoid skipped stitches while sewing on challenging material.</p>

<h3>Satin</h3>

<p>For a fine, sleek fabric like satin you typically want a slender universal needle that has a not-too-sharp point with a size of around 8/60 or 10/70.</p>

<p>Satin shows needle marks badly, so make sure you start your project with a fresh needle! If you start to see any runs, puckers, or obvious needle holes as you sew, you may need to replace your needle in the middle of the project as well.</p>

<h3>Sheers</h3>

<p>You need a fine, skinny needle when you work with sheers. Look for the smallest possible measurements of 8/60 or 10/70. You will also need a lightweight thread to blend with your sheer fabric and fit through the small eye.</p>

<p>You will also want to stay stitch whenever possible to keep this type of material from fraying while you sew.</p>

<h3>Denim</h3>

<p>Denim, otherwise known as jean fabric, gets its own special kind of needle! These typically come in higher thickness like 18/110. They have strong shafts and cutting points to sew through heavy or tightly woven material.</p>

<p>You can use this needle for tightly-woven material like canvas, for sewing any kind of jean fabric, and for sewing through multiple layers of fabric.</p>

<p>As a word of warning, not every domestic sewing machine can handle heavyweight fabric. You can buy specialty machines just for working with denim these days!</p>

<h3>Leather</h3>

<p>Cutting point or leather needles work best for leather because they drive a hole through the thick material, just like an awl does when you work with leather by hand. You can buy these in varying sizes based on the thickness of the leather.</p>

<p>Once again, make sure your sewing machine can handle leather before embarking on a project. If you do plan to sew a leather project, buy several replacement leather needles in case they break while you work.</p>

<h3>Quilting</h3>

<p>Quilting needles have a short blade and fine, round eyes. The shortness of the needle allows extra room for you to insert the thickness of your quilt!</p>

<p>You can purchase a number of different needle sizes depending on the type of fabric you use.</p>

<p>Quilting machines and domestic sewing machines may not always accept the same types of quilting needles, so make sure you read the product description before purchasing.</p>

<h3>Embroidery Machine</h3>

<p>Embroidery machines follow all the same rules as domestic machines for needle selection. For example, you will want a ballpoint needle if you plan to embroider on knit material. You will also want to choose a needle size based on the thickness of the fabric.</p>

<p>Machine embroidery may require specialty threads, though. For this reason, read the user’s manual and make sure you select a needle that can accommodate this type of thread.</p>
"
What Is GSM of Fabric?,
What Is Jacquard Fabric?,"
<p>Jacquard fabric is a type of woven or knit material with an all-over pattern. The pattern is made up of different colored yarns or by varying the stitch type. It’s actually woven into the material and becomes part of the fabric surface.</p>

<p>To be classed as a Jacquard fabric, the material has to be woven on a Jacquard loom. The raised sections are formed when the computer-controlled loom selects a pattern of stitches which are then woven into the fabric. Any fabric with a printed or stamped design or pattern is not a Jacquard.</p>

<p>Patterns on Jacquard fabrics are slightly raised. They stand proud against the rest of the fabric and are known as embossed designs. If you run your fingers across the surface of the textile, you’ll feel the raised elements as you work your way across the fabric. These raised portions are a key identifier for Jacquard fabrics.</p>

<p>Many Jacquard materials have long strands of yarn, called floats, on the back. In a similar way to knitting, these are created as the pattern changes to a different color and then picks up the original color later in the design.</p>

<p>You can also get some Jacquard fabrics with a reversed version of the pattern on the rear of the fabric. This shows a negative image. Rather than being raised, the design shows in dips along the back of the material.</p>

<p>Because of the nature of the weave, some Jacquard fabrics can be reversible. With the design visible on both sides of the fabric, it doesn’t matter which side you use. Knit versions of Jacquard are often identical on both the right and wrong sides, making the choice entirely up to you.</p>

<p>Over time Jacquard has become the go-to generic term for any embossed fabric, whether made from cotton, silk, or polyester. Coming under the Jacquard umbrella are fabrics like matelassé, brocade, and damask.</p>
"
What Are Raglan Sleeves?,"
<p></p>

<p>Raglan sleeves attach to a garment in a diagonal line from the armpit seam to the collar and do not have a seam at the shoulder. The two main styles of sleeve attachment used in shirts and other garments are raglan and set-in sleeves. Traditional set-ins use a seam from the armpit to the shoulder to attach a sleeve to a shirt.</p>

<p>The raglan sleeve style is used a lot in t-shirts, long-sleeved tees, henleys, and sweatshirts, though it can have other uses. You see this kind of sleeve a lot in a three-quarter length sleeve and short sleeves for tees and full-length for sweatshirts and cardigans.</p>

<p>For informal tees, raglan sleeves often come in a contrasting color to the body of the shirt. This technique is called color blocking. For instance, you might have a white shirt with red raglan sleeves to show off the unique shape of the sleeve.</p>

<p>But this contrasting color does not actually define a raglan sleeve. The shape of the sleeve defines whether or not a sleeve is a raglan sleeve or a set-in sleeve!</p>

<p>Another common misconception is that raglan shirts are made of “raglan” fabric. There is no “raglan fabric,” though many shirts featuring raglan sleeves use a certain kind of cotton jersey knit. Instead, raglan shirts always contain that special kind of sleeve with a diagonal seam.</p>

<p>Raglan sleeves originated in the 1800s when a famous British general named Lord Raglan lost his arm to a war wound. He wanted a uniform that fit him better following the amputation. To achieve this, he designed the more flexible shape of the raglan sleeve to allow more mobility for sword fighting.</p>

<p>The style gained popularity when baseball teams began to use it in uniform design. Because of this, you sometimes also see shirts with raglan sleeves called “baseball tees.”</p>
"
